{
  "original": {
    "file": "original.wav",
    "sha256": "25b7bcebc7b4cd765ae74681b923db768732a5a8d70a8b14464ad316a8dadd16",
    "duration_s": 107.75,
    "duration_mmss": "01:47.75",
    "sample_rate": 44100,
    "channels": 2,
    "subtype": "PCM_16",
    "sample_peak_dbfs": -0.1,
    "true_peak_dbtp_4x": 0.85,
    "rms_dbfs": -14.56,
    "crest_factor_db": 14.46,
    "dc_offset_max_abs": 0.0012900473801598998,
    "clipped_samples_ge_0dbfs": 0,
    "head_silence_s": 0.0,
    "tail_silence_s": 0.0,
    "lufs_integrated": -12.0,
    "lra_lu": 4.8,
    "true_peak_dbtp": 0.8,
    "correlation": 0.899700937747471,
    "neg_corr_ratio_1s": 0.0,
    "active_seconds": 107
  },
  "master_24bit": {
    "file": "arranged_master_44k1_24bit.wav",
    "sha256": "3c308cef17075cab1ef7607f11d1dc8d097ca0f39cfc1a024b5ad1659aa67b41",
    "duration_s": 111.372,
    "duration_mmss": "01:51.37",
    "sample_rate": 44100,
    "channels": 2,
    "subtype": "PCM_24",
    "sample_peak_dbfs": -1.01,
    "true_peak_dbtp_4x": -1.0,
    "rms_dbfs": -16.43,
    "crest_factor_db": 15.41,
    "dc_offset_max_abs": 6.669230058726072e-07,
    "clipped_samples_ge_0dbfs": 0,
    "head_silence_s": 0.02,
    "tail_silence_s": 0.78,
    "lufs_integrated": -14.0,
    "lra_lu": 3.9,
    "true_peak_dbtp": -1.0,
    "correlation": 0.9296834442671605,
    "neg_corr_ratio_1s": 0.0,
    "active_seconds": 110
  },
  "distributor_flac": {
    "file": "distributor_candidate_44k1_16bit.flac",
    "sha256": "c8b3fb6dcaea62f70c5cb467b2d3db083f61adbc0903e682b4c51ccc08135699",
    "duration_s": 111.372,
    "duration_mmss": "01:51.37",
    "sample_rate": 44100,
    "channels": 2,
    "subtype": "PCM_16",
    "sample_peak_dbfs": -1.01,
    "true_peak_dbtp_4x": -1.0,
    "rms_dbfs": -16.43,
    "crest_factor_db": 15.41,
    "dc_offset_max_abs": 6.123926850462687e-07,
    "clipped_samples_ge_0dbfs": 0,
    "head_silence_s": 0.02,
    "tail_silence_s": 0.78,
    "lufs_integrated": -14.0,
    "lra_lu": 3.9,
    "true_peak_dbtp": -1.0,
    "correlation": 0.9296834036015861,
    "neg_corr_ratio_1s": 0.0,
    "active_seconds": 110
  },
  "checks": {
    "no_clipping": true,
    "true_peak_below_-1dBTP": true,
    "dc_offset_below_1e-4": true,
    "head_silence_below_8s": true,
    "tail_silence_below_8s": true,
    "stereo_16bit_44k1": true,
    "no_negative_correlation_windows": true
  },
  "all_technical_checks_pass": true,
  "note": "Passing these numbers does not replace a full human listen (timing, dissonance, separation artefacts)."
}